{
  "$schema": "https://json-schema.org/draft/2020-12/schema",
  "title": "VulnerabilityPattern",
  "type": "object",
  "required": [
    "id",
    "name",
    "category",
    "description",
    "severity_baseline",
    "tags"
  ],
  "properties": {
    "id": {
      "type": "string"
    },
    "name": {
      "type": "string"
    },
    "category": {
      "type": "string"
    },
    "component_types": {
      "type": "array",
      "items": {
        "type": "string"
      }
    },
    "applicable_languages": {
      "type": "array",
      "items": {
        "type": "string"
      }
    },
    "description": {
      "type": "string"
    },
    "broken_invariants": {
      "type": "array",
      "items": {
        "type": "string"
      }
    },
    "common_triggers": {
      "type": "array",
      "items": {
        "type": "string"
      }
    },
    "preconditions": {
      "type": "array",
      "items": {
        "type": "string"
      }
    },
    "typical_impact": {
      "type": "array",
      "items": {
        "type": "string"
      }
    },
    "common_false_positives": {
      "type": "array",
      "items": {
        "type": "string"
      }
    },
    "severity_baseline": {
      "type": "string"
    },
    "validation_methods": {
      "type": "array",
      "items": {
        "type": "string"
      }
    },
    "related_case_ids": {
      "type": "array",
      "items": {
        "type": "string"
      }
    },
    "tags": {
      "type": "array",
      "items": {
        "type": "string"
      },
      "minItems": 1
    }
  },
  "additionalProperties": true
}