{
  "id": "lending-stale-solvency-config-transfer-pattern",
  "name": "Stale solvency configuration after debt or position transfer",
  "category": "lending-accounting",
  "component_types": [
    "lending-accounting",
    "position-transfer",
    "debt-token"
  ],
  "applicable_languages": [
    "rust-soroban"
  ],
  "description": "账户的 collateral/debt side、reserve bitmap、risk config 或价格缓存没有在 repay、transfer、migration 后刷新，后续安全路径用旧配置评估新债务或新抵押。 Solidity/EVM 类比来源保留在 related_case_ids 中；strict runtime 检索时该 pattern 按 K2/Soroban 使用。",
  "broken_invariants": [
    "solvency must be computed from live positions and current reserve configuration after every transfer/migration",
    "cached account configuration must not authorize incompatible collateral and debt relationships"
  ],
  "common_triggers": [
    "debt token/aToken transfer to an account with stale config",
    "repay clears debt amount but not collateral-side marker",
    "position migration changes owner/reserve id without clearing risk cache"
  ],
  "preconditions": [
    "存在可转移 debt/position 或等价的 owner migration",
    "安全写路径消费缓存/marker，而不是权威余额与 reserve 配置"
  ],
  "typical_impact": [
    "unsafe borrow, withdrawal while undercollateralized, bad debt, liquidation bypass"
  ],
  "common_false_positives": [
    "token transfer is disabled or only updates non-authoritative view data",
    "every borrow/withdraw/liquidation path reconstructs account data from balances and reserve ids"
  ],
  "severity_baseline": "medium, high if it enables direct bad debt extraction",
  "validation_methods": [
    "create repay -> transfer -> borrow/withdraw/liquidate sequence; compare cached config against authoritative reserve/balance state; assert health factor uses current side/reserve"
  ],
  "related_case_ids": [
    "public-silo-v3-continuous-m-01-stale-collateral-silo"
  ],
  "tags": [
    "stale-cache",
    "debt-transfer",
    "position-transfer",
    "solvency",
    "collateral-accounting",
    "lending"
  ]
}
