{
  "id": "reward-rounding-remainder-loss-pattern",
  "name": "Reward rounding or remainder loss in pro-rata distribution",
  "category": "reward-accounting",
  "component_types": [
    "reward-distribution",
    "yield-token",
    "staking-wrapper"
  ],
  "applicable_languages": [
    "solidity"
  ],
  "description": "Reward calculations truncate or roll over remainders in a way that strands value, lets early exiters lose accrued rewards, or lets later users capture accumulated dust.",
  "broken_invariants": [
    "total distributed rewards plus stored remainder must equal total claimable rewards within a bounded dust threshold",
    "users exiting before a future rollover must not forfeit material already-accrued rewards",
    "low-decimal reward tokens must not make proportional distribution economically unfair"
  ],
  "common_triggers": [
    "integer division in pro-rata reward split",
    "low-decimal reward token",
    "small total reward amount",
    "remainder reused only in later claims"
  ],
  "preconditions": [
    "reward amount is split across holders or shares",
    "claim/transfer/exit timing can differ between users"
  ],
  "typical_impact": [
    "reward loss",
    "unfair distribution",
    "value leakage to later claimers",
    "unmitigated rounding bug in mitigation review"
  ],
  "common_false_positives": [
    "loss is provably bounded to negligible dust",
    "remainder is stored per-user or globally and fairly redistributed before exit",
    "reward token decimals and minimum reward size prevent material truncation"
  ],
  "severity_baseline": "medium when material reward value can be lost by normal users",
  "validation_methods": [
    "construct low-decimal reward token and small reward amount",
    "compare exact rational pro-rata entitlement against actual claim",
    "test early exit before remainder grows enough to distribute"
  ],
  "related_case_ids": [
    "c4-2023-07-reserve-m-04",
    "c4-2023-09-reserve-mitigation-m-04",
    "c4-2023-06-angle-m-05"
  ],
  "tags": [
    "reward-accounting",
    "rounding",
    "precision-loss",
    "pro-rata-distribution",
    "dust-loss"
  ]
}
