{
  "id": "oracle-partial-update-latest-price-pattern",
  "name": "Latest price lookup uses global timestamp instead of pair-complete timestamp",
  "category": "oracle-pricing",
  "component_types": [
    "oracle-pricing",
    "time-series-data",
    "cross-price"
  ],
  "applicable_languages": [
    "rust-soroban"
  ],
  "description": "Oracle 的 latest API 使用全局最新记录时间或全局 index，而不是某个 asset pair / reserve / price leg 都完整存在的最近时间，partial update 后返回 None、旧价或不一致价格。 Solidity/EVM 类比来源保留在 related_case_ids 中；strict runtime 检索时该 pattern 按 K2/Soroban 使用。",
  "broken_invariants": [
    "latest price for a pair must mean latest complete pair observation",
    "partial updates for unrelated assets must not remove or corrupt valid prices for other pairs"
  ],
  "common_triggers": [
    "multi-asset oracle supports partial snapshots",
    "cross-price requires two legs but timestamp comes from global last record",
    "consumer assumes latest API and twap/history API have identical availability semantics"
  ],
  "preconditions": [
    "partial update can be submitted or naturally occurs",
    "downstream protocol treats None/stale latest price as a security-relevant condition"
  ],
  "typical_impact": [
    "oracle DoS, stale/fallback price use, liquidation or borrow availability failures"
  ],
  "common_false_positives": [
    "consumer always scans backward for a complete pair observation",
    "partial updates are impossible due to publisher rules enforced on-chain"
  ],
  "severity_baseline": "medium for oracle availability or stale-price impact; high only with direct liquidation/borrow value extraction",
  "validation_methods": [
    "publish complete pair at t1, partial one-leg update at t2, then call latest pair price and assert it returns t1 complete price rather than None/stale unrelated value"
  ],
  "related_case_ids": [
    "c4-2025-10-reflector-v3-m-05"
  ],
  "tags": [
    "oracle-pricing",
    "partial-update",
    "timestamp",
    "cross-price",
    "availability",
    "soroban-rust"
  ]
}
