{
  "id": "reentrancy-price-redemption-pattern",
  "name": "Reentrancy or read-only reentrancy in pricing/redemption flows",
  "category": "reentrancy",
  "component_types": [
    "redemption-flow",
    "oracle",
    "collateral-management"
  ],
  "applicable_languages": [
    "solidity"
  ],
  "description": "External calls during redemption, swap, or price reads allow nested execution or transient read-only state to influence collateral amounts, APR, or price estimates.",
  "broken_invariants": [
    "redemption/swap accounting must not be changeable by reentrant external token/collateral callbacks",
    "read-only price reads must not observe transient AMM state that can be manipulated mid-call",
    "state used for collateral amounts must be finalized before external interactions or protected by reentrancy guards"
  ],
  "common_triggers": [
    "redeem/swap transfers collateral before all accounting is fixed",
    "Curve virtual price read during read-only reentrancy",
    "external token callback reenters price/redeem function",
    "view function used as oracle during another protocol’s state transition"
  ],
  "preconditions": [
    "external interaction happens before or during accounting-sensitive operation",
    "attacker can trigger callback or transient pool state"
  ],
  "typical_impact": [
    "excess collateral redemption",
    "inflated price",
    "wrong APR",
    "value leakage"
  ],
  "common_false_positives": [
    "all state changes are complete before external calls",
    "oracle uses cached/TWAP value immune to transient state",
    "reentrant path cannot reach any value-affecting function"
  ],
  "severity_baseline": "medium-to-high depending on value movement and repeatability",
  "validation_methods": [
    "add malicious token/collateral callback and attempt nested redeem/swap",
    "simulate read-only reentrancy against AMM virtual price",
    "compare result with and without reentrant/transient state"
  ],
  "related_case_ids": [
    "c4-2023-06-angle-h-01",
    "c4-2023-06-angle-m-03",
    "c4-2023-07-reserve-m-01"
  ],
  "tags": [
    "reentrancy",
    "read-only-reentrancy",
    "redemption",
    "oracle-manipulation",
    "external-call-order"
  ]
}
