{
  "id": "position-registry-tracking-corruption-pattern",
  "name": "Position registry tracking corruption",
  "category": "position-accounting",
  "component_types": [
    "position-accounting",
    "connector",
    "registry"
  ],
  "applicable_languages": [
    "solidity"
  ],
  "description": "Position add/remove/update logic uses the wrong key, flag, connector, owner, or account dimension, causing live external positions to be missing, removed too early, or assigned to the wrong vault.",
  "broken_invariants": [
    "registry entries must represent every active external position exactly once",
    "position IDs must be derived from the same owner/connector/account dimensions on add, update, and remove",
    "decreasing or transferring part of a position must not remove still-active exposure"
  ],
  "common_triggers": [
    "removePosition flag set during borrow/open",
    "ownerConnector vs calculatorConnector mismatch",
    "decreasePosition removes holding while staked LP remains",
    "transferBetweenAccounts mishandles holding positions"
  ],
  "preconditions": [
    "protocol uses a central registry to price or track connector positions",
    "external position lifecycle has partial decrease, borrow, transfer, or stake states"
  ],
  "typical_impact": [
    "TVL undercount",
    "share price error",
    "invisible debt/exposure",
    "incorrect withdrawal/minting"
  ],
  "common_false_positives": [
    "registry is only a cache and every value-moving path recomputes ground truth",
    "external protocol does not support partial or multi-account position shapes",
    "position is intentionally removed because no economic exposure remains"
  ],
  "severity_baseline": "high when registry drives TVL, share price, or solvency checks",
  "validation_methods": [
    "walk add/update/remove for every connector lifecycle branch",
    "assert registry exposure equals external protocol ground truth after partial operations",
    "test key derivation symmetry between owner, calculator, account, and market identifiers"
  ],
  "related_case_ids": [
    "c4-2024-04-noya-h-12",
    "c4-2024-04-noya-h-18",
    "c4-2024-04-noya-h-21",
    "c4-2024-04-noya-h-23",
    "c4-2024-04-dyad-m-06"
  ],
  "tags": [
    "position-accounting",
    "registry",
    "connector",
    "tvl-accounting",
    "state-sync"
  ]
}
