{
  "id": "alternate-entrypoint-access-control-bypass-pattern",
  "name": "Access-control bypass through alternate entrypoint or caller dimension",
  "category": "access-control",
  "component_types": [
    "vault",
    "connector",
    "token",
    "executor"
  ],
  "applicable_languages": [
    "solidity"
  ],
  "description": "The intended restriction is enforced on one path or caller dimension but missed on an alternate entrypoint, approved caller, flash-loan callback, executor, owner/from address, or lifecycle stage.",
  "broken_invariants": [
    "authorization must cover the real asset owner/from address and not only msg.sender or receiver",
    "every alternate entrypoint reaching a value-moving internal function must enforce the same policy",
    "third-party executors or callbacks must not be treated as proof of user intent"
  ],
  "common_triggers": [
    "ERC4626 approved withdraw where owner is not checked",
    "whitelist checks skip from address",
    "blacklisted address also whitelisted",
    "flash-loan connector can call trusted transfer helper",
    "permissionless executor holds trusted role",
    "missing pause modifier on confirm path"
  ],
  "preconditions": [
    "a restricted state, role, or lifecycle stage exists",
    "attacker can enter through an unguarded alternate path"
  ],
  "typical_impact": [
    "compliance bypass",
    "fund theft",
    "withdrawal during pause",
    "reward allocation to attacker-chosen participant"
  ],
  "common_false_positives": [
    "all value-moving internal functions validate owner/from/beneficiary independently",
    "executor validates signed user intent and destination",
    "restriction is purely administrative and cannot change value movement"
  ],
  "severity_baseline": "medium-to-high depending on value movement and trust assumptions",
  "validation_methods": [
    "enumerate every external function reaching the restricted internal path",
    "test caller/from/owner/receiver permutations",
    "test executor/callback path with attacker-controlled calldata"
  ],
  "related_case_ids": [
    "c4-2023-10-ethena-m-01",
    "c4-2023-10-ethena-m-02",
    "c4-2024-11-ethena-labs-m-01",
    "c4-2024-11-ethena-labs-m-02",
    "c4-2024-04-noya-h-08",
    "c4-2024-04-dyad-m-07",
    "c4-2025-03-nudgexyz-m-01",
    "c4-2025-04-kinetiq-m-02"
  ],
  "tags": [
    "access-control-bypass",
    "alternate-entrypoint",
    "owner-validation",
    "executor-trust-boundary",
    "pause-control"
  ]
}
