{
  "id": "reward-transfer-hook-desync-pattern",
  "name": "Reward accounting desync on transfer or claim-on-behalf paths",
  "category": "reward-accounting",
  "component_types": [
    "reward-distribution",
    "yield-token",
    "staking-wrapper"
  ],
  "applicable_languages": [
    "solidity"
  ],
  "description": "Reward state is not synchronized before a balance mutation or delegated claim, causing rewards to attach to the wrong holder, become lost, or be claimable twice.",
  "broken_invariants": [
    "balance-changing hooks must settle sender and receiver reward state before balances change",
    "claim-on-behalf must debit and credit the beneficiary, not an unrelated caller/account",
    "shutdown or wrapper state changes must not redirect accrued rewards"
  ],
  "common_triggers": [
    "ERC20 transfer missing reward update hook",
    "claimRewardsOnBehalf uses wrong account key",
    "staking wrapper shutdown before reward sync",
    "holder array mutation with zero amount transfer/burn"
  ],
  "preconditions": [
    "rewards depend on balances or holder list",
    "users can transfer, burn, claim on behalf, or trigger shutdown while rewards are pending"
  ],
  "typical_impact": [
    "reward theft",
    "lost rewards",
    "double claim",
    "dilution of approved holders"
  ],
  "common_false_positives": [
    "reward index is globally settled before every balance mutation",
    "claim-on-behalf is restricted and uses beneficiary state consistently",
    "zero-value transfer/burn is blocked or cannot mutate holder lists"
  ],
  "severity_baseline": "medium-to-high depending on whether principal or only rewards are affected",
  "validation_methods": [
    "create pending rewards, transfer/burn/claim, and compare each account entitlement",
    "test zero-amount mutations of holder arrays",
    "simulate shutdown with rewards pending"
  ],
  "related_case_ids": [
    "c4-2023-07-reserve-h-03",
    "c4-2023-07-reserve-m-11",
    "c4-2023-07-reserve-m-12",
    "c4-2023-07-reserve-m-15",
    "c4-2024-02-althea-liquid-infrastructure-h-01",
    "c4-2024-02-althea-liquid-infrastructure-m-01",
    "c4-2024-02-althea-liquid-infrastructure-m-02",
    "c4-2024-02-althea-liquid-infrastructure-m-03"
  ],
  "tags": [
    "reward-accounting",
    "transfer-hook",
    "claim-on-behalf",
    "state-desync",
    "holder-list"
  ]
}
