{
  "id": "whitelist-blacklist-role-conflict-pattern",
  "name": "Whitelist / blacklist role conflict in token transfer restrictions",
  "category": "access-control",
  "component_types": [
    "token",
    "redemption-flow"
  ],
  "applicable_languages": [
    "solidity"
  ],
  "description": "Transfer-state logic evaluates whitelist and blacklist roles inconsistently, allowing a dual-role or non-whitelisted holder to burn, redeem, or avoid redistribution in a state where restrictions should apply.",
  "broken_invariants": [
    "blacklist restrictions must dominate whitelist permissions when both roles are present",
    "whitelist-enabled mode must validate the holder/from address, not only a privileged redeemer or caller",
    "redistribution of locked balances must not be front-runnable through an allowed burn path"
  ],
  "common_triggers": [
    "burn branch checks only WHITELISTED_ROLE",
    "redeemer role bypasses from-address whitelist",
    "blacklist and whitelist managers can assign conflicting roles",
    "redistributeLockedAmount lacks destination role check"
  ],
  "preconditions": [
    "token has blacklist/whitelist transfer states",
    "roles can be assigned independently or temporarily conflict"
  ],
  "typical_impact": [
    "locked funds escape redistribution",
    "unauthorized burn/redeem",
    "compliance invariant bypass"
  ],
  "common_false_positives": [
    "role managers are guaranteed to coordinate and enforce mutual exclusion on-chain",
    "burning benefits protocol and cannot harm redistribution or users",
    "redeemer off-chain RFQ is the explicit security boundary and on-chain invariant allows it"
  ],
  "severity_baseline": "medium when compliance or locked-fund redistribution is bypassed",
  "validation_methods": [
    "assign both roles and test every transfer/burn/redeem branch",
    "test non-whitelisted holder redemption through privileged redeemer",
    "front-run redistribution with burn and compare locked balance accounting"
  ],
  "related_case_ids": [
    "c4-2024-11-ethena-labs-m-01",
    "c4-2024-11-ethena-labs-m-02"
  ],
  "tags": [
    "blacklist",
    "whitelist",
    "role-conflict",
    "burn",
    "redemption",
    "access-control-bypass"
  ]
}
