{
  "id": "hook-callback-transitional-state-reentrancy-pattern",
  "name": "Hook/callback observes transitional lending state after checks",
  "category": "reentrancy-and-state-ordering",
  "component_types": [
    "lending-hook",
    "flash-loan",
    "token-callback",
    "external-invocation"
  ],
  "applicable_languages": [
    "rust-soroban"
  ],
  "description": "借贷协议在检查 solvency、collateral binding、pool status 后执行 hook/callback/external invocation，但在最终状态写入前或返回后没有重新校验，使回调可以改变刚刚检查过的账户/储备状态。 Solidity/EVM 类比来源保留在 related_case_ids 中；strict runtime 检索时该 pattern 按 K2/Soroban 使用。",
  "broken_invariants": [
    "security checks must remain valid after every external invocation before value leaves the protocol",
    "callbacks must not be able to observe or mutate half-updated debt/collateral state"
  ],
  "common_triggers": [
    "beforeAction/afterAction hook positioned between check and effect",
    "flash-loan callback updates collateral/debt state consumed later in the same flow",
    "token receiver or custom-account callback reenters a value-moving entrypoint"
  ],
  "preconditions": [
    "reachable callback/external invocation exists",
    "callback can mutate a state variable used by the current flow or a later withdrawal/borrow path"
  ],
  "typical_impact": [
    "collateral freed from debt, solvency bypass, reserve drain, liquidation/repay DoS"
  ],
  "common_false_positives": [
    "callback cannot call back into the same security boundary",
    "all relevant state is finalized before callback and revalidated after callback",
    "failed Soroban invocation rolls back all writes and no partial state persists"
  ],
  "severity_baseline": "medium-to-high when callback can affect funds or solvency",
  "validation_methods": [
    "build a call-order trace; add a malicious hook/callback test; assert checked account data and reserve status before callback equals post-callback state used for final transfer"
  ],
  "related_case_ids": [
    "public-silo-v3-certora-h-01-hook-location-reentrancy"
  ],
  "tags": [
    "hook-callback",
    "reentrancy",
    "state-ordering",
    "solvency",
    "lending",
    "soroban-rust"
  ]
}
