{
  "id": "numeric-domain-cast-overflow-pattern",
  "name": "Numeric domain mismatch, unsafe cast, or precision overflow",
  "category": "arithmetic",
  "component_types": [
    "collateral-management",
    "redemption-flow",
    "oracle"
  ],
  "applicable_languages": [
    "solidity"
  ],
  "description": "Values are cast, truncated, scaled, or accumulated into a numeric domain that is too small or uses the wrong decimals, causing overflow, revert, or wrong collateral/price calculation.",
  "broken_invariants": [
    "casts must prove the value fits the destination bit width before conversion",
    "decimal scaling must match the actual token/feed/underlying domain",
    "piecewise or bounded math must define behavior below/above every segment boundary"
  ],
  "common_triggers": [
    "uint256 to uint128 cast after multiplying or accumulating",
    "collateral ratio cast into smaller type",
    "piecewiseLinear lower-bound missing",
    "base tokens have different decimals on different chains",
    "underlying Comet/asset decimals not used"
  ],
  "preconditions": [
    "protocol handles multi-decimal tokens, cross-chain assets, or bounded integer storage",
    "values can exceed assumed range or fall outside piecewise segments"
  ],
  "typical_impact": [
    "revert/DoS",
    "wrong collateral ratio",
    "wrong TVL",
    "wrong price/share calculation"
  ],
  "common_false_positives": [
    "input ranges are tightly bounded by earlier checks and tests cover max values",
    "token/feed decimals are immutable and validated at registration",
    "overflow can only occur above impossible supply/collateral limits"
  ],
  "severity_baseline": "medium when value movement or availability depends on the calculation",
  "validation_methods": [
    "fuzz max supply, decimals, and collateral ratio boundaries",
    "test value below first piecewise segment and above max segment",
    "compare scaled result against high-precision reference math"
  ],
  "related_case_ids": [
    "c4-2023-06-angle-m-01",
    "c4-2023-06-angle-m-02",
    "c4-2023-06-angle-m-05",
    "c4-2023-07-reserve-h-01",
    "c4-2023-07-reserve-m-02",
    "c4-2024-04-noya-h-02"
  ],
  "tags": [
    "unsafe-cast",
    "overflow",
    "decimal-scaling",
    "precision-loss",
    "numeric-domain"
  ]
}
