{
  "id": "soroban-integer-math-low-denominator-pattern",
  "name": "Integer math precision loss or zero denominator in Soroban financial formulas",
  "category": "numeric-domain",
  "component_types": [
    "fixed-point-math",
    "auction",
    "interest-rate"
  ],
  "applicable_languages": [
    "rust-soroban"
  ],
  "description": "Soroban/Rust DeFi 合约大量使用整数和 fixed-point math。除法先于乘法、低 supply 分母、unchecked rounding 都会放大成 DoS、错误 APR 或价值转移。",
  "broken_invariants": [
    "financial formulas must preserve precision and reject zero/near-zero denominators",
    "rounding direction must not systematically transfer value to attacker"
  ],
  "common_triggers": [
    "low backstop supply makes denominator zero",
    "temporary inflation changes total_supply before util/APR check",
    "division truncates before multiplication"
  ],
  "preconditions": [
    "integer-only financial math",
    "small supply or decimal mismatch possible",
    "no explicit denominator guard"
  ],
  "typical_impact": [
    "DoS, excessive fee extraction, liquidation/auction mispricing, lender loss"
  ],
  "common_false_positives": [
    "all denominators have enforced protocol minimums before calculation",
    "rounding only creates dust below economic threshold and cannot be repeated"
  ],
  "severity_baseline": "medium-to-high depending on reachability and value at risk",
  "validation_methods": [
    "boundary tests for 0/1/min supply; differential test multiply-before-divide; fuzz decimals and rounding direction"
  ],
  "related_case_ids": [
    "c4-2025-02-blend-v2-m-10",
    "c4-2025-02-blend-v2-m-14",
    "c4-2025-02-blend-v2-m-15"
  ],
  "tags": [
    "integer-math",
    "division-before-multiplication",
    "rounding",
    "low-liquidity",
    "soroban-rust",
    "stellar-rust"
  ]
}
