{
  "id": "withdrawal-exit-path-fund-lock-pattern",
  "name": "Withdrawal or exit path fund lock",
  "category": "withdrawal-accounting",
  "component_types": [
    "withdrawal-flow",
    "redemption-flow",
    "wrapper",
    "vault"
  ],
  "applicable_languages": [
    "solidity"
  ],
  "description": "A user’s principal or withdrawal liquidity becomes stuck because the protocol assumes an external integration, oracle method, buffer state, or wrapper path is always available.",
  "broken_invariants": [
    "users must retain a reliable principal exit path unless an explicit pause/restriction is active",
    "reward claiming or external integration failure must not permanently block principal withdrawal",
    "withdrawal liquidity accounting must match where assets actually reside"
  ],
  "common_triggers": [
    "wrapper cannot call external withdrawal after integration state changes",
    "expected oracle() method missing on a vault",
    "native-token receive auto-stakes withdrawal proceeds",
    "cancelWithdrawal does not restore buffer/pending state",
    "blacklisted user in a batch blocks others"
  ],
  "preconditions": [
    "principal is held through wrapper/vault or cross-domain buffer",
    "exit path depends on external method, batch member, or mutable accounting state"
  ],
  "typical_impact": [
    "fund lock",
    "blocked withdrawal",
    "denial of redemption",
    "stuck collateral"
  ],
  "common_false_positives": [
    "emergency withdrawal path is available and tested",
    "only rewards are blocked while principal can exit",
    "pause/blacklist behavior is explicitly per-user and cannot block unrelated users"
  ],
  "severity_baseline": "high when principal can be permanently or broadly locked; medium when temporary/bounded",
  "validation_methods": [
    "force the external call or method assumption to fail and attempt withdrawal",
    "simulate batch with one blocked user and unrelated users",
    "track asset location before queue/cancel/confirm stages"
  ],
  "related_case_ids": [
    "c4-2023-07-reserve-m-05",
    "c4-2023-07-reserve-m-13",
    "c4-2023-07-reserve-m-14",
    "c4-2024-04-dyad-h-05",
    "c4-2024-04-dyad-h-06",
    "c4-2024-04-dyad-h-08",
    "c4-2024-04-noya-h-04",
    "c4-2025-04-kinetiq-h-01",
    "c4-2025-04-kinetiq-h-03",
    "c4-2025-04-kinetiq-m-03"
  ],
  "tags": [
    "withdrawal",
    "redemption",
    "fund-lock",
    "external-integration",
    "buffer-accounting"
  ]
}
