{
  "id": "flash-loan-price-status-manipulation-pattern",
  "name": "Flash-loan manipulable price or collateral-status decision",
  "category": "oracle-manipulation",
  "component_types": [
    "oracle",
    "collateral-management",
    "liquidation",
    "trading"
  ],
  "applicable_languages": [
    "solidity"
  ],
  "description": "A same-transaction capital movement changes pool balances, status checks, or price reads used by the protocol, causing misclassification, liquidation, or value movement based on a transient state.",
  "broken_invariants": [
    "collateral status and price decisions must not depend on same-transaction manipulable spot balances",
    "flash-loan protection must cover every alternate path that can affect the guarded state",
    "a transient manipulated state must not force permanent basket, liquidation, or withdrawal consequences"
  ],
  "common_triggers": [
    "Curve/AMM pool spot balance read",
    "same-block deposit guard bypass via self-liquidation or alternate function",
    "status check based on current pool distribution",
    "flash-loan callback can call trusted transfer logic"
  ],
  "preconditions": [
    "attacker can source temporary liquidity or invoke flash-loan path",
    "protocol reads manipulable state before settlement or without TWAP/bounds"
  ],
  "typical_impact": [
    "forced collateral default",
    "bad liquidation",
    "fund theft between vaults",
    "blocked withdrawal/redeem"
  ],
  "common_false_positives": [
    "protocol uses a manipulation-resistant TWAP or delayed status transition",
    "state change is view-only and cannot trigger value movement",
    "flash-loan guard covers all value-changing alternate paths"
  ],
  "severity_baseline": "high when manipulation directly changes collateral status, vault ownership, or liquidation outcome",
  "validation_methods": [
    "simulate the decision before/during/after a flash-loan state change",
    "assert protected state cannot be changed through alternate entrypoints",
    "measure whether manipulated state persists after transaction or triggers irreversible actions"
  ],
  "related_case_ids": [
    "c4-2023-07-reserve-h-02",
    "c4-2023-07-reserve-m-01",
    "c4-2024-04-dyad-h-10",
    "c4-2024-04-noya-h-08",
    "c4-2024-02-spectra-m-02"
  ],
  "tags": [
    "flash-loan",
    "oracle-manipulation",
    "spot-price",
    "same-block",
    "collateral-status"
  ]
}
