{
  "id": "soroban-duplicate-asset-list-pricing-pattern",
  "name": "Duplicate asset/reserve entries inflate auction or accounting value",
  "category": "input-validation",
  "component_types": [
    "auction",
    "pricing",
    "reserve-list"
  ],
  "applicable_languages": [
    "rust-soroban"
  ],
  "description": "Soroban Vec inputs often carry reserve/asset lists. If code sums value without uniqueness checks, duplicate entries can double count debt, collateral, rewards or auction lots.",
  "broken_invariants": [
    "each reserve/asset must contribute at most once to pricing and accounting",
    "normalization must happen before valuation or state mutation"
  ],
  "common_triggers": [
    "submit duplicated reserve ids to auction creation or pool action",
    "repeat same asset in list used for backstop valuation or reward allocation"
  ],
  "preconditions": [
    "public entrypoint accepts Vec<Address>/Vec<Asset>",
    "valuation loops do not use Set/Map uniqueness or sorted dedupe"
  ],
  "typical_impact": [
    "overpriced auctions, bad debt misallocation, collateral double counting, fund extraction"
  ],
  "common_false_positives": [
    "duplicates are explicitly rejected by lower-level SDK/token calls before protocol valuation",
    "duplicates only affect caller-local display and not persisted accounting"
  ],
  "severity_baseline": "medium-to-high depending on reachability and value at risk",
  "validation_methods": [
    "unit test with [A,A] versus [A]; property test uniqueness-invariant over arbitrary Vec inputs"
  ],
  "related_case_ids": [
    "c4-2025-02-blend-v2-m-04"
  ],
  "tags": [
    "duplicate-assets",
    "input-validation",
    "auction-pricing",
    "soroban-rust",
    "stellar-rust"
  ]
}
