{
  "id": "oracle-stale-timeout-propagation-pattern",
  "name": "Stale oracle timeout or health-state propagation failure",
  "category": "oracle-pricing",
  "component_types": [
    "oracle",
    "collateral-pricing",
    "trading",
    "redemption-flow"
  ],
  "applicable_languages": [
    "solidity"
  ],
  "description": "Composed asset pricing accepts stale, deprecated, timed-out, or partially invalid oracle data as valid, causing extreme prices, blocked redemptions, or unsafe trades. Common in nested collateral, Curve/LP wrappers, RToken-like basket assets, and Chainlink feed adapters.",
  "broken_invariants": [
    "any stale or unhealthy underlying oracle leg must make the composed price invalid or explicitly bounded",
    "oracle freshness windows must not be extended by composition or double-counted timeouts",
    "view-price success must imply all economically relevant price legs are fresh and healthy"
  ],
  "common_triggers": [
    "paired-token oracle timeout in a metapool",
    "nested RToken or basket asset with one stale collateral price",
    "Chainlink feed deprecation/health state not checked",
    "lotPrice/trade quote using only timestamp age"
  ],
  "preconditions": [
    "protocol composes multiple oracle feeds or wrapper prices",
    "one underlying feed can become stale, deprecated, or timed out while the top-level call still returns"
  ],
  "typical_impact": [
    "overpriced collateral",
    "blocked redemption",
    "unsafe trading at stale price",
    "collateral status misclassification"
  ],
  "common_false_positives": [
    "all price legs are independently freshness-checked before aggregation",
    "stale price only affects off-chain display and not mint/redeem/liquidation/trading",
    "governance can disable affected collateral before user-value impact and this is the explicit design assumption"
  ],
  "severity_baseline": "medium-to-high depending on direct value movement and permissionless reachability",
  "validation_methods": [
    "force one underlying feed timeout and assert top-level price reverts or is bounded",
    "compare freshness timestamps across every composed price leg",
    "simulate mint/redeem/liquidation/trade using stale leg and quantify value delta"
  ],
  "related_case_ids": [
    "c4-2023-07-reserve-m-06",
    "c4-2023-07-reserve-m-07",
    "c4-2023-07-reserve-m-08",
    "c4-2023-07-reserve-m-09",
    "c4-2023-07-reserve-m-10"
  ],
  "tags": [
    "oracle",
    "stale-oracle",
    "timeout",
    "collateral-pricing",
    "price-composition",
    "chainlink"
  ]
}
