{
  "id": "cross-domain-balance-location-mismatch-pattern",
  "name": "Cross-domain or external-system balance location mismatch",
  "category": "cross-domain-accounting",
  "component_types": [
    "l1-operations",
    "staking",
    "withdrawal-flow"
  ],
  "applicable_languages": [
    "solidity"
  ],
  "description": "A contract validates or moves balances in the wrong domain or assumes a native-token receipt has the same intent as a user deposit, causing false reverts, fund locks, or incorrect redelegation.",
  "broken_invariants": [
    "balance checks must be performed in the domain where the assets actually reside",
    "native token receipts from system settlement must be distinguished from user deposits",
    "cross-domain queue processing must preserve the intended asset location through each lifecycle stage"
  ],
  "common_triggers": [
    "HyperEVM balance checked for HyperCore funds",
    "receive() auto-stakes L1 withdrawal proceeds",
    "cancelled withdrawal amount redelegated without moving funds to L1",
    "batch deposits/withdrawals not netted before L1 operations"
  ],
  "preconditions": [
    "protocol bridges or mirrors accounting between EVM and an external/L1 system",
    "same token can exist as local balance, queued operation, or external delegated amount"
  ],
  "typical_impact": [
    "fund lock",
    "blocked redelegation",
    "withdrawal failure",
    "yield loss"
  ],
  "common_false_positives": [
    "external system callback is authenticated and routed to a dedicated settlement function",
    "local balance is only an upper-bound safety check and not required for valid external funds",
    "operator can always reconcile without user loss or availability impact"
  ],
  "severity_baseline": "medium-to-high when withdrawal or principal accounting depends on the mismatch",
  "validation_methods": [
    "trace asset location across queue, process, cancel, and confirm stages",
    "mock external settlement transfer into receive() and assert it is not auto-staked",
    "test redelegation when local balance is zero but external balance exists"
  ],
  "related_case_ids": [
    "c4-2025-04-kinetiq-h-01",
    "c4-2025-04-kinetiq-h-03",
    "c4-2025-04-kinetiq-m-01",
    "c4-2025-04-kinetiq-m-04"
  ],
  "tags": [
    "cross-domain-accounting",
    "l1-integration",
    "balance-domain-mismatch",
    "native-token-receive",
    "queue-processing"
  ]
}
