{
  "id": "connector-tvl-miscalculation-pattern",
  "name": "Connector position TVL miscalculation",
  "category": "connector-accounting",
  "component_types": [
    "connector",
    "tvl-accounting",
    "position-accounting",
    "vault"
  ],
  "applicable_languages": [
    "solidity"
  ],
  "description": "A protocol-specific connector miscalculates the value or ownership of an external position, so vault share price, position exposure, or solvency is wrong. Common with Pendle, Balancer, Silo, Morpho, Dolomite, Uniswap V3, and other adapters.",
  "broken_invariants": [
    "connector TVL must include every externally held/staked component that belongs to the vault",
    "connector TVL must not count liquidity or rewards owned by other accounts",
    "registry position updates must track the same owner/account dimensions used by TVL calculation"
  ],
  "common_triggers": [
    "external protocol has staked LP, gauge, market account, or NFT position separate from wallet balance",
    "adapter assumes totalSupply or tick liquidity belongs to the vault",
    "registry removes position while external stake remains",
    "different chains/assets have different decimals"
  ],
  "preconditions": [
    "vault relies on connector-reported TVL for share price or solvency",
    "external protocol position has multiple balances or ownership layers"
  ],
  "typical_impact": [
    "incorrect share mint/redeem price",
    "bad debt",
    "loss of funds during deposit/withdraw",
    "incorrect health factor"
  ],
  "common_false_positives": [
    "TVL is informational only and never used for value movement",
    "connector only supports one external position shape and enforces it on entry",
    "external protocol guarantees the queried balance belongs exclusively to the vault"
  ],
  "severity_baseline": "high when TVL controls share price, collateralization, or withdrawals",
  "validation_methods": [
    "create a minimal external position with all sub-balances and compare adapter TVL to ground truth",
    "change external position ownership/staking state and assert registry still tracks it",
    "fuzz token decimals and multi-token routes"
  ],
  "related_case_ids": [
    "c4-2024-04-noya-h-06",
    "c4-2024-04-noya-h-11",
    "c4-2024-04-noya-h-13",
    "c4-2024-04-noya-h-14",
    "c4-2024-04-noya-h-15",
    "c4-2024-04-noya-h-19",
    "c4-2024-04-noya-h-20",
    "c4-2024-04-noya-h-21",
    "c4-2024-04-noya-h-22",
    "c4-2024-04-noya-h-23"
  ],
  "tags": [
    "connector",
    "tvl-accounting",
    "position-accounting",
    "share-price",
    "external-integration"
  ]
}
