{
  "id": "soroban-storage-ttl-rent-dos-pattern",
  "name": "Storage TTL/rent or unbounded storage creates DoS or state loss",
  "category": "storage-lifecycle",
  "component_types": [
    "soroban-storage",
    "state-lifecycle"
  ],
  "applicable_languages": [
    "rust-soroban"
  ],
  "description": "Soroban storage has persistent/temporary/instance categories, rent and TTL. Protocol logic that stores unbounded user-controlled data or forgets TTL extension can lose state or create resource-cost DoS.",
  "broken_invariants": [
    "critical positions and config must remain live for the full protocol lifecycle",
    "user-controlled storage growth must be bounded and distributed across safe keys"
  ],
  "common_triggers": [
    "attacker appends many reserves/users/orders to one structure",
    "critical temporary entry expires before withdrawal/claim/settlement",
    "large persistent vector/map exceeds ledger entry/resource limits"
  ],
  "preconditions": [
    "unbounded Vec/Map or storage key derived from user input",
    "missing extend_ttl for state needed across ledgers"
  ],
  "typical_impact": [
    "permanent DoS, lost position metadata, settlement failure, excessive rent/resource cost"
  ],
  "common_false_positives": [
    "state is explicitly ephemeral and protocol has a safe rebuild/cleanup path",
    "data size is capped by protocol constants and enforced at every insert"
  ],
  "severity_baseline": "medium-to-high depending on reachability and value at risk",
  "validation_methods": [
    "review storage().persistent/temporary/instance usage; test expiry and max-size states; assert cleanup/TTL extension paths"
  ],
  "related_case_ids": [],
  "tags": [
    "storage-ttl",
    "rent",
    "unbounded-storage",
    "dos",
    "soroban-rust",
    "stellar-rust"
  ]
}
