{
  "id": "soroban-require-auth-entrypoint-bypass-pattern",
  "name": "Missing or inconsistent require_auth across Soroban entrypoints",
  "category": "access-control",
  "component_types": [
    "soroban-contract",
    "entrypoint",
    "authorization"
  ],
  "applicable_languages": [
    "rust-soroban"
  ],
  "description": "Soroban 不存在 EVM msg.sender 式隐式权限。敏感动作必须显式 require_auth，且每个等价 value-moving entrypoint 都要绑定同一个被授权主体。",
  "broken_invariants": [
    "every sensitive transfer/config/claim action must authenticate the account whose balance, position, or authority is consumed",
    "helper-level checks cannot replace public entrypoint coverage when alternate paths exist"
  ],
  "common_triggers": [
    "claiming rewards for another address",
    "calling flash-loan or bridge-like alternate path that skips pool status/auth",
    "using invoker/address parameter mismatch to act for a victim"
  ],
  "preconditions": [
    "public entrypoint exposes user-controlled Address or account id",
    "state mutation or token transfer depends on that address"
  ],
  "typical_impact": [
    "unauthorized claims, fee bypass, restricted pool operation, admin/config mutation"
  ],
  "common_false_positives": [
    "function is private/internal and every caller already authenticated the same account",
    "operation is intentionally permissionless and does not consume another account’s state"
  ],
  "severity_baseline": "medium-to-high depending on reachability and value at risk",
  "validation_methods": [
    "grep for require_auth and Address parameters; build caller matrix for every pub fn; fuzz actor/owner/receiver permutations"
  ],
  "related_case_ids": [
    "c4-2025-02-blend-v2-h-02",
    "c4-2025-02-blend-v2-m-01"
  ],
  "tags": [
    "require-auth",
    "entrypoint-auth",
    "alternate-entrypoint",
    "soroban-rust",
    "stellar-rust"
  ]
}
