{
  "id": "collateral-double-counting-licensing-pattern",
  "name": "Collateral double counting through licensing or registry misconfiguration",
  "category": "collateral-accounting",
  "component_types": [
    "collateral-management",
    "vault",
    "position-accounting"
  ],
  "applicable_languages": [
    "solidity"
  ],
  "description": "The same collateral, vault, or NFT position can be registered in two accounting domains or under the wrong license, inflating collateral ratios or causing registry corruption.",
  "broken_invariants": [
    "the same economic collateral must not be counted twice across normal and special collateral domains",
    "licensing and oracle calculation registries must not share mappings unless they represent the same set",
    "position registry keys must use the correct owner, connector, and account dimensions"
  ],
  "common_triggers": [
    "same vault licensed by two managers",
    "normal and kerosene collateral maps overlap",
    "position removal uses calculatorConnector instead of ownerConnector",
    "deployment script omits required registry setter"
  ],
  "preconditions": [
    "protocol separates collateral classes or connector ownership domains",
    "registration/licensing is mutable or configured by deployment scripts"
  ],
  "typical_impact": [
    "inflated collateral ratio",
    "unbacked minting",
    "missed liquidation",
    "incorrect position TVL"
  ],
  "common_false_positives": [
    "registries are intentionally overlapping but downstream math deduplicates economic exposure",
    "only trusted governance can configure and deployment script is out of scope",
    "double count affects UI only and not mint/liquidation checks"
  ],
  "severity_baseline": "high when minting, liquidation, or collateral-ratio checks rely on the duplicated value",
  "validation_methods": [
    "register the same asset in both domains and compare collateral ratio",
    "trace registry key derivation for add/remove/update calls",
    "test deployment state immediately after scripts run"
  ],
  "related_case_ids": [
    "c4-2024-04-dyad-h-01",
    "c4-2024-04-dyad-m-03",
    "c4-2024-04-dyad-m-08",
    "c4-2024-04-noya-h-12",
    "c4-2024-04-noya-h-18",
    "c4-2024-04-noya-h-23"
  ],
  "tags": [
    "collateral",
    "double-counting",
    "licensing",
    "registry",
    "position-accounting"
  ]
}
