{
  "id": "soroban-emission-accrual-before-state-change-pattern",
  "name": "Reward/emission index not updated before balance or config mutation",
  "category": "reward-accounting",
  "component_types": [
    "emissions",
    "reward-zone",
    "backstop"
  ],
  "applicable_languages": [
    "rust-soroban"
  ],
  "description": "奖励、emissions、interest index 必须在 draw/donate/withdraw/config-change 等状态改变前结算。否则新旧权重混用，导致奖励丢失、重复分配或归属错误。",
  "broken_invariants": [
    "indexes must be synchronized before balance-changing or config-changing operations",
    "already allocated rewards must remain claimable after reward-zone changes"
  ],
  "common_triggers": [
    "draw/donate/withdraw before update_rz_emis_data",
    "remove pool from reward zone before gulping settled emissions",
    "change rate before reserve interest accrual"
  ],
  "preconditions": [
    "global index + per-user/per-pool index model",
    "admin config changes or balance changes share reward state"
  ],
  "typical_impact": [
    "reward theft/loss, emissions dilution, insolvent backstop credit"
  ],
  "common_false_positives": [
    "function is view-only or does not alter any weight used by reward math",
    "a later mandatory settlement runs before any claim/withdraw can observe stale state"
  ],
  "severity_baseline": "medium-to-high depending on reachability and value at risk",
  "validation_methods": [
    "write sequence tests around update-before-mutate; compare rewards under split vs combined operations"
  ],
  "related_case_ids": [
    "c4-2025-02-blend-v2-m-05",
    "c4-2025-02-blend-v2-m-08",
    "c4-2025-02-blend-v2-m-13"
  ],
  "tags": [
    "emissions",
    "accrual-ordering",
    "stale-index",
    "configuration-change",
    "soroban-rust",
    "stellar-rust"
  ]
}
