{
  "id": "queue-processing-gas-dos-pattern",
  "name": "Unbounded queue processing gas DoS",
  "category": "availability",
  "component_types": [
    "queue-processing",
    "withdrawal-flow",
    "l1-operations"
  ],
  "applicable_languages": [
    "solidity"
  ],
  "description": "Permissionless users can grow an array or queue so processing, reset, or deletion exceeds block gas limits, partially or fully disabling a required operation.",
  "broken_invariants": [
    "permissionless queue growth must remain processable under realistic block gas limits",
    "reset/delete paths must be batchable or bounded",
    "minimum amounts and batching rules must make spam economically infeasible"
  ],
  "common_triggers": [
    "many small deposits create pending operations",
    "delete whole pending array at once",
    "reward cycle can be skipped or bricked by one holder",
    "setDistributableERC20s changes array during distribution"
  ],
  "preconditions": [
    "attacker can add entries cheaply",
    "protocol has a batch processor or reset path that loops all entries"
  ],
  "typical_impact": [
    "blocked L1 operations",
    "unclaimable rewards during cycle",
    "partial protocol DoS"
  ],
  "common_false_positives": [
    "processor accepts bounded batch size and can resume safely",
    "attacker cost exceeds griefing impact",
    "queue entries expire or are per-user isolated"
  ],
  "severity_baseline": "medium when critical keeper/user operations can be blocked",
  "validation_methods": [
    "estimate gas as entries grow and compare to block limit",
    "fuzz batch sizes and resume index correctness",
    "test spam with minimum amount economics"
  ],
  "related_case_ids": [
    "c4-2025-04-kinetiq-m-05",
    "c4-2024-02-althea-liquid-infrastructure-m-02",
    "c4-2024-02-althea-liquid-infrastructure-m-03",
    "c4-2024-04-noya-h-10"
  ],
  "tags": [
    "unbounded-loop",
    "gas-dos",
    "queue-processing",
    "batching",
    "denial-of-service"
  ]
}
