{
  "id": "erc4626-share-inflation-donation-pattern",
  "name": "ERC4626 or share-vault donation / deflation attack",
  "category": "vault-accounting",
  "component_types": [
    "vault",
    "token",
    "redemption-flow"
  ],
  "applicable_languages": [
    "solidity"
  ],
  "description": "Direct asset donations, flash-loan share supply changes, or min-share rounding let an attacker distort share math so deposits revert, yield is drained, or shares are minted/redeemed at the wrong rate.",
  "broken_invariants": [
    "unsolicited asset transfers must not let attackers break deposit/redeem share math",
    "flash-loan supply changes must not let attackers drain vault yield or manipulate share price",
    "minimum-share protections must be robust to direct donations and rounding edge cases"
  ],
  "common_triggers": [
    "ERC4626 totalAssets reads raw token balance",
    "minShares check after direct donation",
    "flash-loan principal token deflates vault share supply",
    "first depositor or tiny deposit rounding edge"
  ],
  "preconditions": [
    "vault share math depends on current asset/share balances",
    "attacker can donate assets, flash borrow shares, or choose tiny amounts"
  ],
  "typical_impact": [
    "deposit DoS",
    "yield drain",
    "share inflation",
    "unfair mint/redeem price"
  ],
  "common_false_positives": [
    "vault ignores unsolicited asset balance or sweeps it safely",
    "minimum initial liquidity and virtual shares prevent practical manipulation",
    "impact is bounded to dust and cannot block normal deposits"
  ],
  "severity_baseline": "medium-to-high depending on yield/principal value and repeatability",
  "validation_methods": [
    "donate assets before victim deposit and assert minShares behavior",
    "simulate flash-loan supply manipulation around yield accrual",
    "fuzz tiny deposits and first depositor state"
  ],
  "related_case_ids": [
    "c4-2023-10-ethena-m-04",
    "c4-2024-02-spectra-m-02",
    "c4-2025-04-kinetiq-h-02"
  ],
  "tags": [
    "erc4626",
    "share-accounting",
    "donation-attack",
    "deflation-attack",
    "rounding"
  ]
}
