{
  "id": "pattern-reward-debt-desync",
  "name": "Reward debt desynchronization after balance mutation",
  "category": "accounting",
  "component_types": [
    "reward-distribution",
    "staking",
    "vault"
  ],
  "applicable_languages": [
    "solidity",
    "vyper"
  ],
  "description": "A protocol updates user balance before synchronizing reward baseline, causing reward calculations to rely on stale accounting state.",
  "broken_invariants": [
    "reward baseline must match effective user balance at accounting checkpoints"
  ],
  "common_triggers": [
    "withdraw before debt sync",
    "deposit before pending reward settlement",
    "claim after stale accounting checkpoint"
  ],
  "preconditions": [
    "the protocol stores user balance and reward baseline separately",
    "claimable rewards are derived from cumulative indexes or per-share accounting"
  ],
  "typical_impact": [
    "value-leakage",
    "unfair-allocation"
  ],
  "common_false_positives": [
    "the protocol intentionally delays settlement and corrects it before payout",
    "a later calculation step recomputes pending rewards from current state"
  ],
  "severity_baseline": "medium",
  "validation_methods": [
    "stateful unit test",
    "before-after accounting assertion",
    "two-user reward fairness scenario"
  ],
  "related_case_ids": [
    "case-reward-debt-desync-01"
  ],
  "tags": [
    "state-desync",
    "reward-distribution",
    "value-leakage"
  ]
}
